{
  "migration_id": "MIG-001-chatgpt-send-message",
  "source_capability": "VIVIM ChatGPT send_message (manifest chatgpt block + ChatGPTPlugin chatgpt_send)",
  "source_locations": [
    {"path": "vivim-original-baseline/vivim-final-enhanced/seeds/providers/manifests.ts", "lines": 1221, "sha256": "e1cc34186a17f6f52feaa1df77ad55e4967f7327dc5cc39251c775a626039ff4", "role": "declarative provider knowledge (ChatGPT endpoints/selectors/models/recovery)"},
    {"path": "vivim-original-baseline/vivim-final-enhanced/src/engines/providers/plugins/chatgpt.ts", "lines": 59, "sha256": "d8c63c5e35edf66ee4be6eecd8ccf286ca084176336a68c1de46f39a44f87bae", "role": "imperative provider plugin (same selectors/behavior, duplicate representation)"},
    {"path": "vivim-original-baseline/vivim-final-enhanced/src/engines/provider-registrar.ts", "lines": 406, "sha256": "06d3c12370d4bf2d977114ca265ed28efd68c318f2b5f665c837594a10251010", "role": "registration wiring (live-path authority TBD)"},
    {"path": "vivim-original-baseline/vivim-final-enhanced/src/engines/chrome-governor.ts", "lines": 801, "sha256": "7ae575664558547271056157fd24c3a84f039b87ab12297b4c32c8cb36a14ee6", "role": "browser I/O authority (claimed sole)"},
    {"path": "vivim-original-baseline/vivim-final-enhanced/src/engines/chrome/cdp-proxy.ts", "lines": 373, "sha256": "435d643bc3a3b392d44660de76b517ab4f808b4eedb53ebbe7c99ef14aa4fa32", "role": "CDP session multiplex"},
    {"path": "vivim-original-baseline/vivim-final-enhanced/src/executor/fleet-supervisor.ts", "lines": 655, "sha256": "2967f68f064733474c47aad2a6b56c143f588839ee26a9585d517102ab016cc2", "role": "slave pool/health/reconnect"},
    {"path": "vivim-original-baseline/vivim-final-enhanced/src/executor/cdp-transport.ts", "lines": 336, "sha256": "bc6967d756c2d8aeb8ae27f0aaa3810fdf1d79690eb7ea3755d360fd0e6eba16", "role": "low-level CDP leg"},
    {"path": "vivim-original-baseline/vivim-final-enhanced/src/engines/stream-parser.ts", "lines": 601, "sha256": "ea4966142fedec5b4fd20840f6621c25aa3b461b8b3db2ef46bf1ed7d9fb2b1f", "role": "DB-only parser logic + fallback chain"},
    {"path": "vivim-original-baseline/vivim-final-enhanced/src/engines/conversation-manager.ts", "lines": 1166, "sha256": "546fe934a751ee19bbd9ea4724528822612ca7246ca374ee8b724d14dcf69bab", "role": "turn lifecycle owner (inferred)"},
    {"path": "vivim-original-baseline/vivim-final-enhanced/src/engines/unified-registry.ts", "lines": 232, "sha256": "3f2086fe87409eea073365f7b039f56a142ff53835106b67609270faac63f2e6", "role": "capability resolution"},
    {"path": "vivim-original-baseline/vivim-final-enhanced/src/engines/capability-binder.ts", "lines": 66, "sha256": "61d5273702a0bf8d675475b8df0dd9f04af377cf9abe7420f932fb0c9003bbe5", "role": "provider binding"},
    {"path": "vivim-original-baseline/vivim-final-enhanced/prisma/schema.prisma", "lines": 4157, "sha256": "dc1f4d6190eb740ab1f3e46ab166b1394d1ebb9279f5e8dbcc26124a5c2e11e1", "role": "200-model data mine (partition, never port)"},
    {"path": "omega-baseline/omega-final/contracts/src/provider.ts", "lines": 167, "sha256": "cd8e39c1d7cae5c9c2ab7dbd4ea13c7fb9e5a722d615790534cdd4bbebf171ae", "role": "Omega provider vocabulary (realization lifecycle, EvidenceRef)"},
    {"path": "omega-baseline/omega-final/contracts/src/recipe.ts", "lines": 42, "sha256": "9bcd7491571c062238e3033444349def2257631178f6ec212d2717ae041b5de9", "role": "Omega composition/recipe law"},
    {"path": "omega-baseline/omega-final/plugins/provider-browser/src/index.ts", "lines": 300, "sha256": "9a4d70fd51a33c8bbed1ee6bec4f697b2df9c093ae309933ee85599871a19701", "role": "Omega BROWSER_MEDIATED realization (fixture-only, 4 send bars)"},
    {"path": "omega-baseline/omega-final/plugins/vivim-providers/src/registry.ts", "lines": 92, "sha256": "80f2ba997dddc0b62cb223328e1d8dbaea8a94fc15969ef950370d4cd79dd27e", "role": "Omega pure registry derivation"}
  ],
  "observations": [
    {"claim": "ChatGPT declarative manifest block exists with endpoints/selectors/models/recovery", "confidence": "OBSERVED", "source": "manifests.ts ChatGPT entry"},
    {"claim": "ChatGPTPlugin duplicates the same selectors/behavior imperatively", "confidence": "OBSERVED", "source": "plugins/chatgpt.ts"},
    {"claim": "Which of manifest vs plugin drives the live turn is undetermined", "confidence": "UNKNOWN", "source": "wiring trace outstanding (provider-registrar + protocol generator/loader)"},
    {"claim": "Stream parsing is DB-only with a cycle-guarded fallback chain and zero-DB hot path", "confidence": "OBSERVED", "source": "stream-parser.ts resolveFallbackChain + AGENTS.md invariant 5"},
    {"claim": "Cookie files are login truth; one profile per (provider, account)", "confidence": "OBSERVED", "source": "VIVIM AGENTS.md invariants 6-7 + manifest per_account"},
    {"claim": "Governor is the sole CDP authority", "confidence": "WEAKLY_INFERRED", "source": "file header + canon invariant; import scan outstanding (V-3)"},
    {"claim": "Turn preserves ordering/identity/content", "confidence": "STRONGLY_INFERRED", "source": "manifest + plugin + schema jointly imply it; live proof outstanding"}
  ],
  "behavioral_spec_ref": "bcp-speed/bcp/migration/MIG-001-chatgpt-send-message/behavior-spec.chatgpt-send-message.md",
  "invariants": ["I-1 ordering preserved", "I-2 identity preserved", "I-3 content preserved byte-exact", "I-4 exactly-once delivery intent", "I-5 redact-before-vault", "I-6 failures visible and deterministic"],
  "canonicality": {
    "verdict": "TRANSFORM",
    "rationale": "send_message semantics are canonical product behavior; both VIVIM representations (manifest row, plugin class) are incidental and must not survive as architecture — they become op-map data + realization records behind stable Omega contracts.",
    "decided_by": "agent assay 2026-09-23 (product-intent confirmation still open for OBSOLETE candidates elsewhere, not for send_message itself)"
  },
  "omega_target": {
    "contract_op": "message.send@1 (archetype message.send)",
    "plugin": "provider-browser (BROWSER_MEDIATED) + vivim-providers registry",
    "contracts_touched": ["provider.ts", "recipe.ts", "outcome.ts", "variation.ts", "agent.ts", "computation.ts", "control.ts"],
    "new_contracts": []
  },
  "transformation": {
    "direction": "VIVIM -> Omega (never Omega -> legacy; never import monolith)",
    "mechanism": "one-way adapter: VIVIM knowledge -> serialized op-map/parser-pin/session data -> existing Omega send bars + vault provenance; zero Omega core edits",
    "discarded": ["monolith engine import", "wholesale Prisma port (200 models)", "selector code port", "second scheduler/orchestrator", "new Omega contract"]
  },
  "dependencies": ["existing authenticated ChatGPT profile (assumed, not proven)", "Omega W1 fixture pipeline (green)", "D-355 parser pins + D-385 fence (ratified)", "browser.attach session lifecycle", "vault conversation index D-378 (W3 retention gap acknowledged)"],
  "implementation": {
    "files_touched": ["docs/migration/ (6 new)", "bcp-speed/bcp/migration/migration-record.schema.json (new)", "bcp-speed/bcp/migration/MIG-001-chatgpt-send-message/ (new)", "bcp-speed/bcp/migration/verify_migration.py (new)"],
    "omega_core_edits": 0,
    "notes": "Additive forge-side only. No host, contract, plugin, composition, or BCP-state hand edits."
  },
  "verification_plan": ["V-1 record schema conformance (verify_migration.py)", "V-2 Omega contract-name resolution against contracts/src", "V-3 Governor-exclusivity import scan (outstanding — recorded, not faked)", "V-4 BCP validate.py healthy", "V-5 sweep dry-run no drift", "V-6 recorded-fixture integration via existing Omega harness (W1 pattern)", "V-7 LIVE browser run (UNVERIFIED — named unblock, independent witness required)"],
  "verification_result": {
    "verdict": "INTENTIONALLY_TRANSFORMED",
    "detail": "STATIC proven (V-1/V-2/V-4/V-5 green); INTEGRATION proven at recorded-fixture level (V-6 via pre-existing W1 harness); LIVE UNVERIFIED by explicit record (V-7 outstanding with unblock procedure); no equivalence claim beyond the transformed contract path."
  },
  "evidence": [
    "bcp-speed/bcp/migration/MIG-001-chatgpt-send-message/assay.chatgpt-send-message.md",
    "bcp-speed/bcp/migration/MIG-001-chatgpt-send-message/behavior-spec.chatgpt-send-message.md",
    "bcp-speed/bcp/migration/MIG-001-chatgpt-send-message/omega-mapping.json",
    "bcp-speed/bcp/migration/MIG-001-chatgpt-send-message/verification-report.md",
    "docs/migration/ (6 forensic/mapping/contract/slice/risk docs)",
    "BCP discovery entries via bcp_tool.py (dual-path finding, DB-only parser law)"
  ],
  "disposition": "Transformed",
  "provenance": {
    "agent": "opencode/muse-spark (Prompt-1 execution 2026-09-23)",
    "timestamp": "2026-09-23T00:00:00Z",
    "sources_hash": "sha256 over the 16 source files pinned in source_locations"
  },
  "proof_ladder": {
    "static": "PROVEN (verify_migration.py + BCP validate/sweep)",
    "integration": "PROVEN-recorded-fixture (existing W1 harness pattern; no new live claims)",
    "live": "UNVERIFIED (no authenticated profile + Chrome run in this environment; unblock in FIRST_VERTICAL_SLICE section 6)",
    "regression": "UNVERIFIED (restart/mutation/failure-injection deferred to live run)"
  },
  "open_unknowns": ["U-1 attachment semantics", "U-2 ChatGPT completion-detection rule", "U-3 dedup/replay exactness", "manifest-vs-plugin live authority", "Governor-exclusivity import scan", "per-method proxy audit", "provider/account->slave determinism proof", "auth recovery production-readiness"]
}
